keyword,category1,itention,sv,kd,octr
jasa pembuatan aplikasi android,Services,generic,3300,25,94
jasa pembuatan aplikasi,Services,generic,600,26,83
jasa membuat aplikasi android,Services,generic,300,25,100
jasa aplikasi android,Services,generic,200,25,94
harga jasa pembuatan aplikasi android,Services,generic,150,15,53
jasa buat aplikasi android,Services,generic,150,24,83
jasa bikin aplikasi android,Services,generic,100,26,90
jasa pembuatan aplikasi android murah,Services,generic,150,28,100
jasa aplikasi android murah,Services,generic,100,25,83
jasa buat aplikasi android murah,Services,generic,80,29,88
jasa bikin aplikasi android murah,Services,generic,30,28,83
jasa membuat aplikasi android murah,Services,generic,30,27,100
jasa pembuatan mobile apps murah,Services,generic,30,26,88
jasa pembuatan aplikasi android online shop,Services,generic,100,20,53
jasa pembuatan aplikasi toko online android,Services,generic,40,19,64
jasa pembuatan aplikasi ios,Services,generic,50,19,100
jasa pembuatan aplikasi android dan ios,Services,generic,40,20,88
jasa pembuatan aplikasi android jakarta,Services,geo,200,20,83
harga jasa pembuatan aplikasi android jakarta,Services,geo,20,27,83
jasa aplikasi android jakarta,Services,geo,20,20,88
jasa pembuatan aplikasi mobile jakarta,Services,geo,10,19,100
jasa pembuatan mobile apps jakarta,Services,geo,10,19,88
jasa pembuatan website di bali,Services,geo,300,13,86
jasa website bali,Services,geo,250,14,83
jasa pembuatan website bali,Services,geo,200,16,83
jasa web bali,Services,geo,150,14,83
jasa web design bali,Services,geo,50,15,88
jasa pembuatan website murah di bali,Services,geo,40,16,83
jasa pembuatan website murah di denpasar,Services,geo,30,16,88
jasa pembuatan web di bali,Services,geo,30,15,88
jasa web murah di bali,Services,geo,20,15,83
jasa website serang,Services,geo,80,19,100
jasa pembuatan website bandung,Services,geo,2000,24,83
jasa pembuatan software android,Services,generic,30,27,83
jasa pembuatan mobile apps,Services,generic,100,19,86
jasa pembuatan aplikasi mobile,Services,generic,80,19,90
harga jasa pembuatan mobile apps,Services,generic,10,17,86
jasa pembuatan mobile application,Services,generic,10,21,83
jasa pembuatan aplikasi android pulsa,Services,generic,60,24,88
jasa pembuatan aplikasi android untuk skripsi,Services,generic,40,13,83
harga jasa pembuatan program aplikasi,Services,generic,100,21,84
jasa pembuatan aplikasi desktop,Services,generic,70,19,83
jasa membuat aplikasi,Services,generic,60,28,86
jasa pembuatan program aplikasi,Services,generic,60,17,90
jasa pembuatan aplikasi online,Services,generic,30,26,83
jasa pembuatan aplikasi online shop,Services,generic,150,19,83
jasa pembuatan aplikasi toko online,Services,generic,100,13,83
jasa website bandung,Services,geo,800,26,88
jasa web bandung,Services,geo,150,22,84
jasa pembuatan website profesional bandung,Services,geo,80,21,90
jasa pembuatan website di bandung,Services,geo,60,21,100
jasa web design bandung,Services,geo,20,17,83
jasa pembuatan aplikasi ojek online,Services,generic,150,17,83
jasa pembuatan aplikasi gojek,Services,generic,20,7,94
jasa pembuatan software akuntansi,Services,generic,70,16,83
jasa pembuatan aplikasi database,Services,generic,20,15,83
jasa pembuatan aplikasi excel,Services,generic,20,23,88
jasa pembuatan software pos,Services,generic,20,20,83
jasa pembuatan software toko,Services,generic,10,14,84
jasa pembuatan software kasir,Services,generic,10,11,83
jasa pembuatan software,Services,generic,300,18,83
jasa pembuatan software aplikasi,Services,generic,100,18,83
jasa pembuatan software murah,Services,generic,100,14,100
jasa pembuatan sistem informasi,Services,generic,100,8,90
jasa pembuatan software custom,Services,generic,60,5,83
jasa pembuatan aplikasi berbasis web,Services,generic,150,20,86
jasa pembuatan aplikasi web,Services,generic,70,19,83
jasa pembuatan aplikasi web base,Services,generic,40,21,83
jasa pembuatan aplikasi berbasis web murah,Services,generic,20,18,88
jasa pembuatan web aplikasi,Services,generic,20,18,88
jasa pembuatan website dan aplikasi,Services,generic,20,19,83
jasa pembuatan website,Services,generic,26000,38,83
jasa pembuatan web,Services,generic,800,38,83
jasa pembuatan website profesional,Services,generic,700,28,83
jasa pembuatan situs website,Services,generic,700,39,83
jasa pembuatan website terbaik,Services,generic,600,29,56
harga jasa pembuatan website,Services,generic,150,28,55
jasa web development,Services,generic,60,30,88
harga jasa pembuatan website profesional,Services,generic,50,17,53
harga jasa pembuatan web,Services,generic,50,30,54
jasa pembuatan web site,Services,generic,40,38,83
jasa pembuatan web profesional,Services,generic,40,30,83
jasa pembuatan website online,Services,generic,30,38,88
berapa harga jasa pembuatan website,Services,generic,30,27,55
proposal jasa pembuatan website,Services,generic,30,23,94
jasa web profesional,Services,generic,20,28,83
jasa web terbaik,Services,generic,20,29,53
jasa pembuatan website wordpress,Services,generic,150,25,88
jasa pembuatan website joomla,Services,generic,40,10,88
harga jasa pembuatan website wordpress,Services,generic,30,22,55
jasa pembuatan website seo,Services,generic,1100,25,90
jasa pembuatan website dan seo,Services,generic,200,26,83
jasa web seo,Services,generic,60,29,90
jasa pembuatan website seo friendly,Services,generic,40,13,86
jasa pembuatan website murah,Services,generic,900,38,83
jasa pembuatan website murah dan berkualitas,Services,generic,350,33,84
jasa web murah,Services,generic,100,38,83
jasa pembuatan website termurah,Services,generic,30,39,94
jasa pembuatan web murah,Services,generic,20,39,83
jasa pembuatan website terpercaya,Services,generic,100,32,53
jasa pembuatan website custom,Services,generic,90,13,83
penyedia jasa pembuatan website,Services,generic,50,33,60
biaya jasa pembuatan website,Services,generic,40,26,55
tips memilih jasa pembuatan website,Services,generic,40,21,60
jasa pembuatan website terbaik di indonesia,Services,generic,40,29,53
software produksi manufaktur,Product,generic,50,14,54
jasa pembuatan website bagus,Services,generic,40,28,64
jasa pembuatan website indonesia,Services,generic,40,36,83
jasa web terpercaya,Services,generic,40,30,56
surat penawaran jasa pembuatan website,Services,generic,30,18,86
contoh penawaran jasa pembuatan website,Services,generic,30,18,86
perusahaan jasa pembuatan website,Services,generic,30,34,86
jasa web kilat,Services,generic,30,22,84
jasa web support,Services,generic,20,15,83
jasa web indonesia,Services,generic,20,26,64
jasa web,Services,generic,700,29,83
jasa web design,Services,generic,600,26,94
jasa web desain,Services,generic,200,28,100
jasa web developer,Services,generic,150,28,83
jasa web design murah,Services,generic,100,30,83
harga jasa web design,Services,generic,50,26,86
jasa pembuatan web design,Services,generic,40,30,83
jasa web design profesional,Services,generic,20,25,94
jasa web designer,Services,generic,20,24,86
harga jasa web developer,Services,generic,20,24,58
jasa website cilegon,Services,geo,700,13,83
jasa pembuatan website cilegon,Services,geo,50,15,64
jasa website jakarta,Services,geo,2000,19,86
jasa pembuatan website jakarta,Services,geo,1300,22,83
jasa web jakarta,Services,geo,350,15,83
jasa pembuatan website murah jakarta,Services,geo,200,15,83
jasa pembuatan website murah di jakarta,Services,geo,200,15,83
jasa pembuatan website di jakarta,Services,geo,150,21,83
jasa pembuatan website profesional jakarta,Services,geo,150,20,83
jasa web developer jakarta,Services,geo,60,20,53
jasa web semarang,Services,geo,20,15,94
jasa pembuatan website surabaya,Services,geo,1800,19,53
jasa website surabaya,Services,geo,500,19,83
jasa web surabaya,Services,geo,150,14,86
jasa pembuatan website di surabaya,Services,geo,90,19,83
jasa pembuatan website murah di surabaya,Services,geo,90,15,83
jasa web design surabaya,Services,geo,60,21,86
jasa pembuatan web surabaya,Services,geo,30,19,53
jasa website di surabaya,Services,geo,20,19,86
jasa pembuatan website jogja,Services,geo,250,25,88
jasa web jogja,Services,geo,200,25,90
jasa pembuatan website yogyakarta,Services,geo,100,24,83
jasa pembuatan website di jogja,Services,geo,70,24,88
jasa pembuatan website perusahaan,Services,generic,300,32,83
jasa pembuatan website company profile,Services,generic,200,20,100
jasa pembuatan web company profile,Services,generic,40,20,84
jasa web company profile,Services,generic,30,19,100
jasa web perusahaan,Services,generic,20,29,83
jasa pembuatan web perusahaan,Services,generic,20,34,83
jasa pembuatan website toko online,Services,generic,350,35,86
jasa pembuatan web toko online,Services,generic,200,35,83
jasa web toko online,Services,generic,150,36,83
jasa pembuatan website online shop,Services,generic,100,35,83
jasa pembuatan website toko online murah dan berkualitas,Services,generic,100,29,83
jasa pembuatan website ecommerce,Services,generic,100,22,86
jasa pembuatan website toko online profesional,Services,generic,100,32,83
jasa pembuatan website e commerce,Services,generic,80,22,83
jasa pembuatan website toko online terbaik,Services,generic,70,35,83
jasa pembuatan website e-commerce murah,Services,generic,50,26,100
jasa pembuatan website ecommerce profesional,Services,generic,40,16,83
harga jasa pembuatan website toko online,Services,generic,40,21,53
jasa pembuatan website dan toko online,Services,generic,30,36,83
jasa web online shop,Services,generic,20,37,83
jasa pembuatan web e commerce,Services,generic,20,22,83
jasa pembuatan web toko online murah,Services,generic,20,35,88
jasa pembuatan website pemerintah,Services,generic,40,10,84
jasa pembuatan web jogja,Services,geo,60,24,86
jasa pembuatan website di yogyakarta,Services,geo,30,23,83
jasa pembuatan website pekanbaru,Services,geo,90,15,100
jasa web pekanbaru,Services,geo,60,15,86
jasa website pekanbaru,Services,geo,40,15,100
jasa pembuatan website di pekanbaru,Services,geo,30,16,90
jasa web riau,Services,geo,30,19,100
jasa website medan,Services,geo,5000,19,83
jasa pembuatan website medan,Services,geo,300,17,94
jasa web medan,Services,geo,300,17,86
jasa pembuatan website di medan,Services,geo,150,15,94
jasa web design jakarta,Services,geo,300,20,83
jasa pembuatan aplikasi android bandung,Services,geo,150,11,64
jasa aplikasi android bandung,Services,geo,40,8,64
jasa pembuatan aplikasi android di bandung,Services,geo,30,11,55
jasa pembuatan aplikasi android semarang,Services,geo,50,8,100
jasa pembuatan aplikasi android solo,Services,geo,20,3,64
jasa pembuatan aplikasi android surabaya,Services,geo,100,8,83
jasa aplikasi android surabaya,Services,geo,20,10,83
jasa pembuatan aplikasi android di malang,Services,geo,20,12,88
jasa pembuatan aplikasi android malang,Services,geo,20,11,88
jasa pembuatan aplikasi android jogja,Services,geo,200,5,53
jasa aplikasi android jogja,Services,geo,20,5,90
jasa pembuatan software bandung,Services,geo,20,4,86
jasa pembuatan software jakarta,Services,geo,30,10,53
jasa pembuatan software semarang,Services,geo,30,5,86
jasa pembuatan software surabaya,Services,geo,150,5,84
jasa pembuatan software malang,Services,geo,20,10,86
jasa website di bali,Services,geo,200,12,83
jasa web di bali,Services,geo,60,13,83
jasa pembuatan website denpasar,Services,geo,40,13,53
jasa pembuatan website tangerang,Services,geo,400,9,83
jasa website tangerang,Services,geo,250,12,94
jasa pembuatan website di tangerang,Services,geo,150,9,100
jasa pembuatan website tangerang selatan,Services,geo,50,7,64
jasa pembuatan website murah di tangerang,Services,geo,40,9,83
jasa pembuatan website batam,Services,geo,70,8,86
jasa website batam,Services,geo,40,9,88
jasa pembuatan website di batam,Services,geo,30,8,83
jasa web batam,Services,geo,20,9,90
jasa pembuatan website bengkulu,Services,geo,30,5,64
jasa pembuatan website bekasi,Services,geo,600,9,94
jasa website bekasi,Services,geo,250,10,86
jasa pembuatan website di bekasi,Services,geo,200,10,94
jasa pembuatan website murah bekasi,Services,geo,30,10,88
jasa pembuatan website murah di bekasi,Services,geo,30,10,100
jasa web design bekasi,Services,geo,20,11,94
jasa pembuatan website bogor,Services,geo,300,8,88
jasa web bogor,Services,geo,250,6,90
jasa website bogor,Services,geo,150,11,83
jasa pembuatan website di bogor,Services,geo,150,10,94
jasa pembuatan website depok,Services,geo,100,10,100
jasa pembuatan website di depok,Services,geo,40,10,83
jasa pembuatan website cibubur,Services,geo,60,8,56
jasa web cilegon,Services,geo,20,10,88
jasa pembuatan website jatiasih,Services,geo,30,5,90
jasa web cikarang,Services,geo,60,6,100
jasa pembuatan website jakarta barat,Services,geo,200,11,64
jasa pembuatan website jakarta timur,Services,geo,150,9,64
jasa pembuatan website jakarta selatan,Services,geo,50,5,94
jasa pembuatan website pondok gede,Services,geo,40,5,100
jasa pembuatan website di jakarta selatan,Services,geo,30,7,94
jasa website semarang,Services,geo,200,12,83
jasa pembuatan website semarang,Services,geo,150,11,90
jasa pembuatan website di semarang,Services,geo,60,12,88
jasa pembuatan website solo,Services,geo,150,12,90
jasa pembuatan website di solo,Services,geo,60,12,100
jasa pembuatan website purwokerto,Services,geo,80,5,64
jasa pembuatan website gresik,Services,geo,90,1,100
jasa web gresik,Services,geo,20,2,100
jasa web malang,Services,geo,250,9,83
jasa website malang,Services,geo,150,8,100
jasa pembuatan website malang,Services,geo,80,6,100
jasa pembuatan website di malang,Services,geo,60,5,100
jasa desain website malang,Services,geo,20,6,86
jasa pembuatan website marketplace,Services,generic,150,20,83
jasa pembuatan website sidoarjo,Services,geo,80,8,64
jasa pembuatan website portal berita,Services,generic,60,16,83
jasa pembuatan website berita,Services,generic,40,15,83
jasa pembuatan website portal berita murah,Services,generic,30,16,83
jasa pembuatan website mlm,Services,generic,150,12,88
jasa web mlm,Services,generic,100,11,90
jasa pembuatan web mlm,Services,generic,100,12,83
jasa web pulsa,Services,generic,70,5,100
jasa pembuatan website mlm binary,Services,generic,50,10,88
jasa pembuatan website pulsa,Services,generic,50,8,90
banner jasa pembuatan website,Services,generic,30,19,94
jasa pembuatan website iklan baris,Services,generic,30,12,94
jasa pembuatan template website,Services,generic,30,23,83
jasa pembuatan website replika,Services,generic,30,8,83
iklan jasa pembuatan website,Services,generic,30,13,84
jasa pembuatan website server pulsa,Services,generic,30,6,83
jasa pembuatan web replika,Services,generic,30,9,88
jasa web gis,Services,generic,20,7,90
jasa pembuatan web support paytren,Services,generic,20,18,83
jasa pembuatan web landing page,Services,generic,20,18,83
jasa pembuatan web support mlm,Services,generic,20,12,100
jasa pembuatan website kediri,Services,geo,60,3,64
jasa pembuatan website banjarmasin,Services,geo,60,4,100
jasa website banjarmasin,Services,geo,20,6,64
jasa website balikpapan,Services,geo,100,6,100
jasa pembuatan website balikpapan,Services,geo,40,7,100
jasa pembuatan web sekolah,Services,generic,100,16,88
jasa pembuatan website sekolah,Services,generic,80,19,83
jasa pembuatan website sekolah murah,Services,generic,40,16,83
jasa web sekolah,Services,generic,30,18,100
jasa website samarinda,Services,geo,40,6,100
jasa pembuatan website di lampung,Services,geo,70,6,100
jasa pembuatan website lampung,Services,geo,60,6,100
jasa website lampung,Services,geo,40,7,100
jasa pembuatan website di lombok,Services,geo,70,11,100
jasa pembuatan website makassar,Services,geo,150,6,86
jasa pembuatan website di makassar,Services,geo,70,6,100
jasa website makassar,Services,geo,60,6,94
jasa pembuatan website kotamobagu,Services,geo,40,9,100
jasa pembuatan website padang,Services,geo,70,1,64
jasa website padang,Services,geo,30,1,84
jasa pembuatan website palembang,Services,geo,100,10,100
jasa pembuatan website travel,Services,generic,70,13,83
jasa pembuatan website travel online,Services,generic,60,11,83
jasa pembuatan website tiket online,Services,generic,50,17,83
jasa pembuatan website travel agent,Services,generic,40,10,83
jasa pembuatan website tour travel,Services,generic,30,12,83
jasa pembuatan website hotel,Services,generic,30,8,83
jasa desain website,Services,generic,300,36,83
jasa desain website murah,Services,generic,90,39,100
jasa desain website profesional,Services,generic,80,29,83
jasa desain website toko online,Services,generic,30,33,83
jasa pembuatan desain website,Services,generic,20,28,86
jasa maintenance website,Services,generic,150,8,56
jasa maintenance website murah,Services,generic,30,6,86
jasa optimasi website,Services,generic,150,13,83
jasa perbaikan website,Services,generic,60,5,64
jasa perawatan website,Services,generic,40,9,86
jasa perbaikan website murah,Services,generic,20,4,83
jasa website palembang,Services,geo,50,10,100
jasa maintenance website jakarta,Services,geo,10,6,83
software house di bali,Company,geo,30,9,90
software house bali,Company,geo,80,13,90
perusahaan it di bali,Company,geo,70,21,100
perusahaan it tangerang,Company,geo,200,23,100
perusahaan it di tangerang,Company,geo,70,23,94
software house batam,Company,geo,50,18,94
perusahaan it di batam,Company,geo,30,23,64
software house di bandung,Company,geo,80,2,84
software house bandung,Company,geo,400,1,86
perusahaan software di bandung,Company,geo,80,9,100
perusahaan it di bandung,Company,geo,50,13,100
perusahaan it bandung,Company,geo,150,14,100
vendor it di jakarta,Company,geo,10,25,88
software house jakarta,Company,geo,450,6,83
software house di jakarta,Company,geo,30,5,83
perusahaan software di jakarta,Company,geo,100,10,94
perusahaan it solution di jakarta,Company,geo,30,17,100
perusahaan it jakarta,Company,geo,60,21,56
perusahaan it di jakarta,Company,geo,80,20,58
software house semarang,Company,geo,150,6,84
perusahaan it semarang,Company,geo,30,26,100
perusahaan it di semarang,Company,geo,40,28,100
software house purwokerto,Company,geo,60,12,100
software house solo,Company,geo,50,10,60
perusahaan it di solo,Company,geo,20,8,64
software house surabaya,Company,geo,350,11,94
software house di surabaya,Company,geo,20,15,100
perusahaan it surabaya,Company,geo,60,21,100
perusahaan it di surabaya,Company,geo,150,27,100
software house malang,Company,geo,250,4,100
software house di malang,Company,geo,100,3,100
perusahaan software di malang,Company,geo,20,3,100
perusahaan it di malang,Company,geo,50,15,100
software house sidoarjo,Company,geo,20,1,100
software house yogyakarta,Company,geo,150,21,94
software house jogja,Company,geo,70,22,100
perusahaan it jogja,Company,geo,60,18,64
perusahaan it di yogyakarta,Company,geo,40,18,94
perusahaan it di jogja,Company,geo,150,18,64
jogja software house,Company,geo,20,22,100
software house lampung,Company,geo,30,31,90
software house medan,Company,geo,20,10,100
perusahaan it di medan,Company,geo,40,14,100
it consultant,Company,generic,900,20,100
konsultan it,Company,generic,700,22,100
it consultant indonesia,Company,generic,150,18,100
it consultant company,Company,generic,150,40,88
jasa konsultan it,Company,generic,50,19,100
konsultan it indonesia,Company,generic,40,12,83
konsultan it bali,Company,geo,200,15,94
it consultant bandung,Company,geo,100,13,94
konsultan it bandung,Company,geo,70,11,100
konsultan it di bandung,Company,geo,20,9,100
it consultant jakarta,Company,geo,350,20,83
konsultan it jakarta,Company,geo,100,12,60
perusahaan it consultant di jakarta,Company,geo,60,8,86
perusahaan konsultan it di jakarta,Company,geo,40,8,88
konsultan it di jakarta,Company,geo,40,11,86
it konsultan jakarta,Company,geo,30,8,94
konsultan it surabaya,Company,geo,70,13,56
it consultant surabaya,Company,geo,20,11,100
perusahaan konsultan it,Company,generic,80,13,56
perusahaan konsultan it di indonesia,Company,generic,50,10,83
perusahaan it consultant,Company,generic,30,9,64
perusahaan it konsultan,Company,generic,20,8,60
software house indonesia,Company,generic,60,20,55
software house,Company,generic,1200,19,53
perusahaan software house,Company,generic,40,10,56
perusahaan it solution,Company,generic,40,1,60
perusahaan it indonesia,Company,generic,150,11,64
perusahaan it di indonesia,Company,generic,150,12,64
perusahaan it developer,Company,generic,20,14,100
perusahaan it,Company,generic,700,11,60
perusahaan software indonesia,Company,generic,90,17,64
perusahaan software di indonesia,Company,generic,90,16,64
perusahaan software development di indonesia,Company,generic,20,13,60
perusahaan software,Company,generic,30,28,41
perusahaan pembuat software di indonesia,Company,generic,20,20,64
perusahaan pembuat software,Company,generic,20,27,64
vendor it terbaik di indonesia,Company,generic,10,7,100
vendor it,Company,generic,100,18,100
it vendor,Company,generic,40,21,100
system integrator indonesia,Company,generic,200,14,100
system integrator,Company,generic,600,15,60
perusahaan system integrator di indonesia,Company,generic,30,13,100
perusahaan system integrator,Company,generic,50,12,58
system integrator jakarta,Company,geo,60,9,100
perusahaan system integrator di jakarta,Company,geo,40,5,94
software manufaktur,Product,generic,80,16,64
aplikasi sistem informasi manufaktur,Product,generic,20,14,100
aplikasi proses manufaktur,Product,generic,10,17,64
aplikasi manufaktur,Product,generic,30,15,100
production planning and inventory control ppic,Product,generic,20,11,100
production planning and inventory control,Product,generic,100,12,86
production planning and control,Product,generic,700,27,55
software manajemen produksi,Product,generic,20,16,55
sistem informasi manajemen produksi,Product,generic,100,27,64
production operation management,Product,generic,20,37,35
production management,Product,generic,100,31,37
production and operations management,Product,generic,90,39,34
production and operation management,Product,generic,20,39,41
production and inventory management,Product,generic,40,28,94
sistem inventory dengan codeigniter,Product,generic,20,7,90
sistem inventory berbasis web,Product,generic,50,18,86
sistem inventory,Product,generic,200,15,55
sistem informasi inventory dengan framework codeigniter,Product,generic,90,13,100
sistem informasi inventory berbasis web,Product,generic,40,16,88
sistem inventory gudang,Product,generic,70,16,60
sistem informasi inventory gudang berbasis web,Product,generic,70,19,100
sistem informasi inventory gudang,Product,generic,30,19,100
sistem inventory barang dengan php,Product,generic,50,8,94
sistem inventory barang berbasis web,Product,generic,90,17,100
sistem inventory barang,Product,generic,100,16,55
sistem informasi inventory barang berbasis web,Product,generic,90,18,83
sistem informasi inventory barang,Product,generic,100,19,100
software inventory barang,Product,generic,70,18,54
software inventory,Product,generic,350,27,83
software inventaris barang,Product,generic,70,23,100
aplikasi untuk stok barang,Product,generic,100,11,54
aplikasi stok barang untuk android,Product,generic,80,11,55
aplikasi stok barang gudang,Product,generic,70,10,53
aplikasi stok barang di android,Product,generic,70,10,58
aplikasi stok barang dan penjualan,Product,generic,30,8,64
aplikasi stok barang berbasis web,Product,generic,50,13,94
aplikasi stok barang android,Product,generic,200,10,55
aplikasi stok barang,Product,generic,1900,10,64
aplikasi penjualan dan stok barang,Product,generic,50,11,55
aplikasi stok barang php,Product,generic,150,8,90
aplikasi stok barang ios,Product,generic,20,21,94
aplikasi stok barang dengan barcode,Product,generic,50,13,55
aplikasi stok barang codeigniter,Product,generic,90,4,94
software inventory terbaik,Product,generic,20,19,53
software inventory indonesia,Product,generic,100,18,90
jual software inventory gudang,Product,generic,20,32,84
excel inventory control software,Product,generic,30,39,82
vendor management inventory,Product,generic,60,21,54
software inventory management,Product,generic,20,37,83
management inventory,Product,generic,150,24,55
inventory management system,Product,generic,350,40,86
inventory management software indonesia,Product,generic,100,19,82
inventory management software,Product,generic,350,49,52
inventory management,Product,generic,2000,39,35
sistem informasi inventaris kampus,Product,generic,40,21,100
sistem informasi inventaris barang sekolah,Product,generic,150,15,100
aplikasi inventaris barang sekolah dengan excel,Product,generic,200,1,90
aplikasi inventaris barang sekolah berbasis web,Product,generic,200,11,100
aplikasi inventaris barang sekolah,Product,generic,200,6,100
sistem informasi inventaris barang berbasis web,Product,generic,20,17,90
sistem informasi inventaris barang,Product,generic,90,19,100
sistem informasi inventaris,Product,generic,80,19,94
aplikasi inventaris barang php,Product,generic,100,10,90
aplikasi inventaris barang excel,Product,generic,100,18,100
aplikasi inventaris barang dengan access,Product,generic,150,14,100
aplikasi inventaris barang berbasis web,Product,generic,70,13,90
aplikasi inventaris barang,Product,generic,250,28,55
sistem informasi inventaris kantor berbasis web,Product,generic,70,17,100
sistem informasi inventaris barang kantor,Product,generic,200,20,100
aplikasi inventaris barang kantor excel,Product,generic,200,6,100
aplikasi inventaris barang kantor berbasis web,Product,generic,90,12,86
aplikasi inventaris barang kantor,Product,generic,50,23,55
sistem informasi inventory,Product,generic,200,17,100
sistem informasi gudang inventory,Product,generic,40,20,100
inventory software,Product,generic,150,48,82
inventory sistem,Product,generic,40,13,53
inventory planning,Product,generic,30,23,56
